{
  "access": {
    "identity": {
      "id": 6,
      "username": "spyroot",
      "web_url": "https://gitlab.dcloud.run/spyroot"
    },
    "observed_capability": [
      "identity_read",
      "target_read"
    ],
    "status": "PASS",
    "target": {
      "full_path": "hott/test",
      "id": 123,
      "kind": "project",
      "web_url": "https://gitlab.dcloud.run/hott/test"
    }
  },
  "captured_at": "2026-10-18T14:08:14.329032+00:00",
  "errors": [],
  "execution_host": "mac.lan",
  "filters": {
    "from": null,
    "limit": 50,
    "name_glob": null,
    "pipeline_id": 3919,
    "project": "hott/test",
    "ref": null,
    "search": null,
    "status": [],
    "stuck_after": 600,
    "to": null
  },
  "kind": "gitlab_job",
  "operation": "list",
  "records": [
    {
      "created_at": "2026-10-18T14:07:08.441000+00:00",
      "duration": 4.466802,
      "failure_reason": null,
      "finished_at": "2026-10-18T14:07:23.573000+00:00",
      "id": 60269,
      "name": "hello_world_05",
      "pipeline_id": 3919,
      "ref": "neroshige/ci-skills-job-list-smoke-20261007",
      "runner": {
        "description": "cai-gitlab-runner02",
        "id": 75
      },
      "stage": "smoke",
      "started_at": "2026-10-18T14:07:19.106000+00:00",
      "status": "success",
      "stuck": false,
      "web_url": "https://gitlab.dcloud.run/hott/test/-/jobs/60269"
    },
    {
      "created_at": "2026-10-18T14:07:08.431000+00:00",
      "duration": 4.446947,
      "failure_reason": null,
      "finished_at": "2026-10-18T14:07:20.563000+00:00",
      "id": 60268,
      "name": "hello_world_04",
      "pipeline_id": 3919,
      "ref": "neroshige/ci-skills-job-list-smoke-20261007",
      "runner": {
        "description": "cai-gitlab-runner01",
        "id": 74
      },
      "stage": "smoke",
      "started_at": "2026-10-18T14:07:16.116000+00:00",
      "status": "success",
      "stuck": false,
      "web_url": "https://gitlab.dcloud.run/hott/test/-/jobs/60268"
    },
    {
      "created_at": "2026-10-18T14:07:08.421000+00:00",
      "duration": 4.422463,
      "failure_reason": null,
      "finished_at": "2026-10-18T14:07:18.950000+00:00",
      "id": 60267,
      "name": "hello_world_03",
      "pipeline_id": 3919,
      "ref": "neroshige/ci-skills-job-list-smoke-20261007",
      "runner": {
        "description": "cai-gitlab-runner02",
        "id": 75
      },
      "stage": "smoke",
      "started_at": "2026-10-18T14:07:14.527000+00:00",
      "status": "success",
      "stuck": false,
      "web_url": "https://gitlab.dcloud.run/hott/test/-/jobs/60267"
    },
    {
      "created_at": "2026-10-18T14:07:08.410000+00:00",
      "duration": 4.419243,
      "failure_reason": null,
      "finished_at": "2026-10-18T14:07:15.966000+00:00",
      "id": 60266,
      "name": "hello_world_02",
      "pipeline_id": 3919,
      "ref": "neroshige/ci-skills-job-list-smoke-20261007",
      "runner": {
        "description": "cai-gitlab-runner01",
        "id": 74
      },
      "stage": "smoke",
      "started_at": "2026-10-18T14:07:11.547000+00:00",
      "status": "success",
      "stuck": false,
      "web_url": "https://gitlab.dcloud.run/hott/test/-/jobs/60266"
    },
    {
      "created_at": "2026-10-18T14:07:08.394000+00:00",
      "duration": 4.631233,
      "failure_reason": null,
      "finished_at": "2026-10-18T14:07:14.375000+00:00",
      "id": 60265,
      "name": "hello_world_01",
      "pipeline_id": 3919,
      "ref": "neroshige/ci-skills-job-list-smoke-20261007",
      "runner": {
        "description": "cai-gitlab-runner02",
        "id": 75
      },
      "stage": "smoke",
      "started_at": "2026-10-18T14:07:09.743000+00:00",
      "status": "success",
      "stuck": false,
      "web_url": "https://gitlab.dcloud.run/hott/test/-/jobs/60265"
    }
  ],
  "schema_version": "1.0",
  "skill": {
    "algorithm": "sha256-tree-v1",
    "consuming_project": {
      "commit": null,
      "source": null
    },
    "digest": "0d343fe1d4c8dc6bda5172f572306f6e1f2b50dfdf0d6b0a0d5938a624fab0a8",
    "file_count": 207,
    "functional_digest": "5c8a13b2c648a054c1988092cb72af4dff6b6c6c1394d3de4692ee51709e6b9a",
    "revision": {
      "source": "installer_record",
      "value": "d8ab14b2d4d408975bc378ce871737bd014bbe44",
      "verified": true
    }
  },
  "status": "PASS",
  "summary": {
    "error_count": 0,
    "record_count": 5
  },
  "target": "https://gitlab.dcloud.run",
  "target_source": "project;argv:--project",
  "tested_revision": "d8ab14b2d4d408975bc378ce871737bd014bbe44",
  "truncated": false
}
